{
  "id": "home-foundations-60min-v2",
  "version": 2,
  "schemaVersion": 2,
  "locale": "es-MX",
  "space": {
    "widthM": 2,
    "lengthM": 2
  },
  "equipment": [
    "ball",
    "mat",
    "wall"
  ],
  "safety": [
    "Dolor, bloqueo, inflamación o inestabilidad reales: detente y busca valoración."
  ],
  "resources": [
    {
      "exerciseId": "wall-push-up",
      "exerciseVersion": 1,
      "assetId": "quaternius-wall-push-up-v1",
      "assetVersion": 1,
      "sha256": "9826e9d1660ba734d9dbb8b4170e69442985ebf83efe1f2672172c6160bc4268",
      "clipName": "EX_wall-push-up__bilateral__v1",
      "sceneId": "guided-standing-v1"
    },
    {
      "exerciseId": "hip-hinge",
      "exerciseVersion": 1,
      "assetId": "quaternius-hip-hinge-v1",
      "assetVersion": 1,
      "sha256": "45466b100e7f1aa3d6d66643f9cdcd612a83de3d0b6a22257b960d82969ac4fe",
      "clipName": "EX_hip-hinge__neutral__v1",
      "sceneId": "guided-standing-v1"
    },
    {
      "exerciseId": "inside-inside",
      "exerciseVersion": 3,
      "assetId": "quaternius-inside-inside-v2",
      "assetVersion": 2,
      "sha256": "c96528aeb997b0838ac7a70e7c8cec33a274a34abab43c14c2301468aa70032b",
      "clipName": "EX_inside-inside__alternating__v2",
      "sceneId": "guided-standing-v1"
    },
    {
      "exerciseId": "glute-bridge",
      "exerciseVersion": 1,
      "assetId": "quaternius-glute-bridge-v1",
      "assetVersion": 1,
      "sha256": "412c0d349515ba4cbe70620f96d15e0ff7e23852d807f7bcd7dc0238b68fc195",
      "clipName": "EX_glute-bridge__bilateral__v1",
      "sceneId": "guided-floor-v1"
    },
    {
      "exerciseId": "active-march",
      "exerciseVersion": 2,
      "assetId": "quaternius-active-march-v2",
      "assetVersion": 2,
      "sha256": "4c3dc89ab1b0e8239348d72d950fa7a437869f6a55f869177c31e18b0351b7f3",
      "clipName": "EX_active-march__alternate__v2",
      "sceneId": "guided-standing-v1"
    },
    {
      "exerciseId": "mini-squat",
      "exerciseVersion": 2,
      "assetId": "quaternius-mini-squat-v2",
      "assetVersion": 2,
      "sha256": "ff89b9f237aa37089b4a7f7b1409d31ed30c78a5f6a3aebe8f715e545af10295",
      "clipName": "EX_mini-squat__bilateral__v2",
      "sceneId": "guided-standing-v1"
    },
    {
      "exerciseId": "ankle-mobility-left",
      "exerciseVersion": 1,
      "assetId": "quaternius-ankle-mobility-left-v1",
      "assetVersion": 1,
      "sha256": "7fa938d70f7f8e78e331edceee031feb8cf1fc63dfdb0bbd95c2748cf361c0ec",
      "clipName": "EX_ankle-mobility__left__v1",
      "sceneId": "guided-standing-v1"
    },
    {
      "exerciseId": "ankle-mobility-right",
      "exerciseVersion": 1,
      "assetId": "quaternius-ankle-mobility-right-v1",
      "assetVersion": 1,
      "sha256": "b2cb2ae9b98bd0e2b797cf08ae871115e429e0cb1f073c6721daf77b7be5a2bb",
      "clipName": "EX_ankle-mobility__right__v1",
      "sceneId": "guided-standing-v1"
    },
    {
      "exerciseId": "soft-step-turn-left",
      "exerciseVersion": 2,
      "assetId": "quaternius-soft-step-turn-left-v2",
      "assetVersion": 2,
      "sha256": "4586a6fd26a371a9660f6f889142e7526e631c19b10edfa6a09c6fd4d3017f4d",
      "clipName": "EX_soft-step-turn__left__v2",
      "sceneId": "guided-standing-v1"
    },
    {
      "exerciseId": "soft-step-turn-right",
      "exerciseVersion": 2,
      "assetId": "quaternius-soft-step-turn-right-v2",
      "assetVersion": 2,
      "sha256": "da5d91c5543eaf9efc2e04e8770bed32d9ac47e8321904fb72cff788130554b1",
      "clipName": "EX_soft-step-turn__right__v2",
      "sceneId": "guided-standing-v1"
    },
    {
      "exerciseId": "dead-bug",
      "exerciseVersion": 1,
      "assetId": "quaternius-dead-bug-v1",
      "assetVersion": 1,
      "sha256": "7b542e74674ad5507e082999477e41ed796edce8ec437061d8ec8059c76fb7de",
      "clipName": "EX_dead-bug__arms-supported__v1",
      "sceneId": "guided-floor-v1"
    },
    {
      "exerciseId": "slow-breathing",
      "exerciseVersion": 1,
      "assetId": "quaternius-slow-breathing-v1",
      "assetVersion": 1,
      "sha256": "2cb821747e60e1eb9d2cd56926f7523777b31584092fa3f1e9ee82000861e132",
      "clipName": "EX_slow-breathing__comfortable-standing__v1",
      "sceneId": "guided-standing-v1"
    },
    {
      "exerciseId": "lateral-sole-roll-left",
      "exerciseVersion": 3,
      "assetId": "quaternius-lateral-sole-roll-left-v2",
      "assetVersion": 2,
      "sha256": "efbeec5f720ff34b5e117e8573f436971e64c674045cf5b9b853f18926daf8af",
      "clipName": "EX_lateral-sole-roll__left__v2",
      "sceneId": "guided-standing-v1"
    },
    {
      "exerciseId": "lateral-sole-roll-right",
      "exerciseVersion": 3,
      "assetId": "quaternius-lateral-sole-roll-right-v2",
      "assetVersion": 2,
      "sha256": "14a8173378bc47782349d674feafd61b39347135d83001d4d6cd51d85dc8e38d",
      "clipName": "EX_lateral-sole-roll__right__v2",
      "sceneId": "guided-standing-v1"
    },
    {
      "exerciseId": "inside-outside-left",
      "exerciseVersion": 3,
      "assetId": "quaternius-inside-outside-left-v2",
      "assetVersion": 2,
      "sha256": "a6e08d54003dc807cee6bf15001a73b2b9b62fcce5fb82291d18ad6d8dd88776",
      "clipName": "EX_inside-outside__left__v2",
      "sceneId": "guided-standing-v1"
    },
    {
      "exerciseId": "inside-outside-right",
      "exerciseVersion": 3,
      "assetId": "quaternius-inside-outside-right-v2",
      "assetVersion": 2,
      "sha256": "88dfb6b227c4ed96a78ad27183ab7d0bce940fd7b252b37092314274fdab7f41",
      "clipName": "EX_inside-outside__right__v2",
      "sceneId": "guided-standing-v1"
    }
  ],
  "title": "Fundamentos en casa · 60 minutos",
  "reviewStatus": "draft",
  "expectedDurationSeconds": 3600,
  "blocks": [
    {
      "id": "warmup",
      "title": "Preparación gradual",
      "rounds": 1,
      "expectedSeconds": 480,
      "items": [
        {
          "id": "warmup-1",
          "exerciseId": "active-march",
          "exerciseVersion": 2,
          "side": "alternate",
          "round": 1,
          "demonstrationSeconds": 15,
          "workSeconds": 40,
          "restSeconds": 5,
          "exampleRepetitions": 5,
          "dose": "40 s a ritmo cómodo, sin correr ni saltar.",
          "doseKind": "time-based",
          "targetRepetitions": null,
          "repetitionUnit": null,
          "preparation": "Colócate con espacio libre alrededor y observa el ejemplo."
        },
        {
          "id": "warmup-2",
          "exerciseId": "ankle-mobility-left",
          "exerciseVersion": 1,
          "side": "left",
          "round": 1,
          "demonstrationSeconds": 15,
          "workSeconds": 35,
          "restSeconds": 10,
          "exampleRepetitions": 4,
          "dose": "Hasta 4 repeticiones completas; después descansa.",
          "doseKind": "repetition-based",
          "targetRepetitions": 4,
          "repetitionUnit": "complete-movement",
          "preparation": "Colócate con espacio libre alrededor y observa el ejemplo."
        },
        {
          "id": "warmup-3",
          "exerciseId": "ankle-mobility-right",
          "exerciseVersion": 1,
          "side": "right",
          "round": 1,
          "demonstrationSeconds": 15,
          "workSeconds": 35,
          "restSeconds": 10,
          "exampleRepetitions": 4,
          "dose": "Hasta 4 repeticiones completas; después descansa.",
          "doseKind": "repetition-based",
          "targetRepetitions": 4,
          "repetitionUnit": "complete-movement",
          "preparation": "Colócate con espacio libre alrededor y observa el ejemplo."
        },
        {
          "id": "warmup-4",
          "exerciseId": "hip-hinge",
          "exerciseVersion": 1,
          "side": "none",
          "round": 1,
          "demonstrationSeconds": 15,
          "workSeconds": 35,
          "restSeconds": 10,
          "exampleRepetitions": 4,
          "dose": "Hasta 4 repeticiones completas; después descansa.",
          "doseKind": "repetition-based",
          "targetRepetitions": 4,
          "repetitionUnit": "complete-movement",
          "preparation": "Colócate con espacio libre alrededor y observa el ejemplo."
        },
        {
          "id": "warmup-5",
          "exerciseId": "active-march",
          "exerciseVersion": 2,
          "side": "alternate",
          "round": 1,
          "demonstrationSeconds": 15,
          "workSeconds": 40,
          "restSeconds": 5,
          "exampleRepetitions": 5,
          "dose": "40 s a ritmo cómodo, sin correr ni saltar.",
          "doseKind": "time-based",
          "targetRepetitions": null,
          "repetitionUnit": null,
          "preparation": "Colócate con espacio libre alrededor y observa el ejemplo."
        },
        {
          "id": "warmup-6",
          "exerciseId": "mini-squat",
          "exerciseVersion": 2,
          "side": "none",
          "round": 1,
          "demonstrationSeconds": 15,
          "workSeconds": 30,
          "restSeconds": 15,
          "exampleRepetitions": 4,
          "dose": "Hasta 4 repeticiones completas; después descansa.",
          "doseKind": "repetition-based",
          "targetRepetitions": 4,
          "repetitionUnit": "complete-movement",
          "preparation": "Colócate con espacio libre alrededor y observa el ejemplo."
        },
        {
          "id": "warmup-7",
          "exerciseId": "soft-step-turn-left",
          "exerciseVersion": 2,
          "side": "left",
          "round": 1,
          "demonstrationSeconds": 20,
          "workSeconds": 20,
          "restSeconds": 20,
          "exampleRepetitions": 2,
          "dose": "Hasta 2 giros y regresos por pasos; después descansa.",
          "doseKind": "repetition-based",
          "targetRepetitions": 2,
          "repetitionUnit": "out-and-back",
          "preparation": "Detén el balón y déjalo fuera del recorrido de tus pies. Gira levantando y recolocando cada pie."
        },
        {
          "id": "warmup-8",